{
  "id": "geodesic",
  "title": "Geodesic",
  "description": "A curve that parallel-transports its own tangent; for a metric-compatible Levi-Civita connection it describes locally straight motion and, with suitable qualification, extremal interval or length.",
  "domains": [
    "mathematics",
    "relativity"
  ],
  "aliases": [
    "Geodesic curve"
  ],
  "relations": [
    {
      "type": "requires",
      "target": "calculus"
    },
    {
      "type": "requires",
      "target": "differential-geometry"
    },
    {
      "type": "requires",
      "target": "metric"
    },
    {
      "type": "requires",
      "target": "parallel-transport"
    },
    {
      "type": "used-in",
      "target": "schwarzschild-spacetime",
      "note": "Geodesics describe idealized free-fall and light propagation in Schwarzschild spacetime."
    },
    {
      "type": "used-in",
      "target": "general-relativity",
      "note": "Geodesics model idealized freely falling test particles and light rays in general relativity."
    }
  ]
}
