{"id":"chern-class","title":"Chern Class","description":"A sequence of characteristic classes of a complex vector bundle, lying in even-degree integral cohomology and encoding its global topology.","domains":["mathematics","mathematical-physics"],"aliases":["Chern classes"],"relations":[{"type":"requires","target":"characteristic-class"},{"type":"requires","target":"vector-bundle","note":"A complex vector bundle has an underlying real vector bundle together with a compatible fiberwise complex structure."}]}
