{"id":"frobenius-theorem","title":"Frobenius Theorem","description":"The theorem characterizing when a constant-rank tangent distribution is locally tangent to a family of immersed submanifolds: precisely when the distribution is involutive under Lie brackets.","domains":["mathematics","mathematical-physics"],"aliases":["Frobenius integrability theorem"],"relations":[{"type":"requires","target":"tangent-distribution"},{"type":"used-in","target":"foliation"}]}
